{
  "loop_id": "LOOP-20260506-104500",
  "status": "done",
  "mode": "autoresearch",
  "target_project": "C:\\Users\\IgorPC\\.claude\\projects\\Mirofish INTEIA",
  "task_id": "MF-RL-003-study",
  "ralph_done_signal": false,
  "worktree_state": "dirty",
  "recovery_state": "none",
  "verification": {
    "type": "rubric",
    "command": "OpenSwarm source inspection + transcript mapping + AutoResearch artifact check",
    "passed": true,
    "evidence": ".autoresearch/experiments/openswarm-specialist-routing-v1 contains RANKING.md, scores.json, PATCH_PROPOSTO.diff and DECISAO.md"
  },
  "scores": {
    "formato_blocos": 96,
    "verificabilidade_factual": 93,
    "acionabilidade": 92,
    "protocolo_sem_muro": 91,
    "red_team_real": 86,
    "dominio_especifico": 94
  },
  "review": {
    "review_debt": "medium",
    "adversarial_review": true,
    "human_review_required": false
  },
  "autoresearch": {
    "method_signal": "weak_pm",
    "candidate_targets": [
      ".ralph/AUTORESEARCH.md",
      ".ralph/PM.md",
      ".ralph/TASK_TEMPLATE.md"
    ],
    "experiment_recommended": true,
    "efesto_seed_used": true
  },
  "blockers": [],
  "blocked_reason": "",
  "next_action": "Apply or review .autoresearch/experiments/openswarm-specialist-routing-v1/PATCH_PROPOSTO.diff in a separate Ralph cycle.",
  "human_needed": false
}

