{
  "loop_id": "LOOP-20260506-012604",
  "status": "done",
  "mode": "code",
  "target_project": "C:\\Users\\IgorPC\\.claude\\projects\\Mirofish INTEIA",
  "task_id": "MF-RL-001",
  "ralph_done_signal": false,
  "worktree_state": "dirty",
  "recovery_state": "none",
  "verification": {
    "type": "build",
    "command": ".\\backend\\.venv\\Scripts\\python.exe -m pytest backend\\tests -q; npm run build",
    "passed": true,
    "evidence": "backend 171 passed; frontend build passed"
  },
  "scores": {
    "formato_blocos": 92,
    "verificabilidade_factual": 96,
    "acionabilidade": 90,
    "protocolo_sem_muro": 92,
    "red_team_real": 84,
    "dominio_especifico": 93
  },
  "review": {
    "review_debt": "medium",
    "adversarial_review": false,
    "human_review_required": false
  },
  "autoresearch": {
    "method_signal": "weak_verification",
    "candidate_targets": [
      ".ralph/VERIFY.md",
      ".ralph/SECURITY.md"
    ],
    "experiment_recommended": false,
    "efesto_seed_used": false
  },
  "blockers": [],
  "blocked_reason": "",
  "next_action": "Create MF-RL-002 to assess P0.1 readiness without running a long LLM simulation.",
  "human_needed": false
}
